catalog_id,text
0,The Key to the Dow's Bull Market? Energy Stocks
1,Dollar tumbles against yen
2,Google Drive price cuts signal start of Cloud Storage Wars - What will Dropbox
3,"Gov. Cuomo Unveils Plan To Combat HIV, AIDS"
4,China Credit Gauge Declines as Officials Seek to Tame Debt Boom
5,Archie comic banned in Singapore due to same-sex marriage depiction
6,4th of July Gas Prices Pump Up at its Highest Since 2008
7,"iPad Pro UK release date, specs, features and rumours; 12.9in iPad Pro on track"
8,Foster Farms Issues Another Recall over Salmonella Fears
9,Lamar Odom Finally Agrees to Divorce Reality TV Star Khloe Kardashian
10,Ford Mustang Celebrates 50 Years with Limited-Run Special
11,'The Avengers: Age Of Ultron' Video: Joss Whedon Apologizes To Seoul On A
12,"Norfolk Southern railroad to report 1Q earnings Wednesday, detail impact of"
13,Two Senators Have A Simple And Very Unpopular Idea For Saving The Highway
14,A cure for jet lag? Perhaps mathematics and an app can help
15,"Amazon Prime Music launches, gives subscribers a million tunes to stream"
16,Opie & Anthony Host Calls Black Woman a 'Savage' During Racist Twitter Rant
17,Want to date Lindsay Lohan? Tinder's new verified account will make it easier for
18,Apple smart home questioned
19,Chrysler Recalls 780K Minivans Over Window Switch Defect
20,Thousands Protest For Higher Wages At McDonald's Company Shareholder
21,Another Sexual Abuse Lawsuit Filed Against Bryan Singer
22,Jet magazine ending print edition
23,LG Teases Round Smartwatch For IFA Showing
24,Ford's Answer To Cadillac's Classist And Greedy Commercial Is Perfect
25,Manhattan Building Explosion Update: At Least Two People Have Been Killed
26,"Sales Of Nest Protect Resume At Lower Price, Minus Potentially Unsafe Feature"
27,Marvel cranks up sarcasm and '70s sound for Guardians of Galaxy
28,DA Davidson Does Not See Another Bidder Emerging for Cbeyond
29,Kim Kardashian And Kanye West Vogue Cover: Couple Held 'Top Secret Shoot
30,Scientists identify 'high-priority' chemicals that may cause breast cancer
31,"Crews work to reopen Ohio, Ontario ramps later today"
32,Belle Knox In New York City: A Party Report
33,Facebook to build second data center in Altoona
34,Twitter Inc Is Reportedly Removing @Replies And #Hashtags
35,"Ryan Gosling and Eva Mendes going to be parents, reports say"
36,'Ill-fated' Malaysian Airlines mulls changing name to boost reputation
37,Which Quicksilver Look is Better?
38,Morrissey Knocked To The Ground By Stage Invader At San Jose Concert
39,One in five Ivy Leagues students use ADHD medications to get ahead
40,"Laughs, tears mark annual cancer survivor dinner"
41,Harry Potter Star Rupert Grint Heads to Broadway
42,"Not So Yum! Waffle Tacos Can't Stem Bleeding At KFC, Pizza Hut"
43,"O'Shea Jackson Jr., Marcus Callender, Jason Mitchell Join NWA Movie Cast"
44,"So, You Still Haven't Filed? IRS Offers Very Last Minute Tax Tips as April 15 Nears"
45,"Chinese boat accused of ramming, sinking Vietnamese fishing boat"
46,"Oprah Winfrey, 60, declares age is just a number in a stunning tight red gown"
47,Homer Simpson Takes On The ALS Ice Bucket Challenge! (Video)
48,More Texas homeowners getting out from being underwater on mortgages
49,PM Erdogan gets international rap ahead of elections over blocking of Twitter in
50,Angus T. Jones is still badmouthing 'Two and a Half Men' one year after he quit
51,Another Kardashian hits Paris ahead of the big wedding
52,Apple plans to release 'Smart Home' software in June
53,Ariana Grande - Break Free Ft. Zedd
54,Starbucks Takes Warren Buffett's Advice to Heart
55,FTC Regulators Independently Back Tesla's Direct Sales Model
56,'Mad Men' Review: Nip It in the Bud
57,FTC inquiry into Herbalife prompts big share selloff
58,"Loonie up, March retail sales miss expectations, traders look to inflation data"
59,Allergy Season Set to Peak the Next Couple Weeks
60,SunTrust Bank Reaches $320 Mln Settlement With DoJ On HAMP Program
61,Bryan Singer withdraws from X-Men promo over 'completely false' claims he
62,"Climate Change Making Food Crops Less Nutritious, Research Finds"
63,Yawning continues to puzzle the experts
64,"Rising CO2 levels may cut nutrient levels in crops, study finds"
65,WhatsApp boss on Facebook privacy fears: 'Our principles will not change'
66,Duke Energy tells SC the utility's coal ash ponds are safe; environmentalists
67,"Prince announces not one, but two, new studio albums"
68,Bachelorette Andi Dorfman Resigns From Job With District Attorney
69,Ebola outbreak thought to have spread to Sierra Leone
70,Reading Rainbow Raising $1 Million to Return As Online Show
71,"New Transformers 4 Trailer Premiering Thursday, May 15"
72,"Intel Security (McAfee), Positioned in the Leaders Quadrant for Secure Web"
73,Box Office: '22 Jump Street' Soars to $25M Friday; 'Dragon 2' Hits $18.5M
74,What to look for in Procter & Gamble's earnings
75,Draft of Dylan's 'Like a Rolling Stone' Could Sell for $2M
76,Childhood vaccines vindicated once more
77,'Candy Crush' maker King to go public
78,'Wolf-Rayet' Star 20 Times As Massive As The Sun Explodes In Supernova
79,Home»News»Business»Applications for US jobless benefits fall to 302000; 4
80,Big Bang stalls on pay rise dispute
81,"Nintendo to launch new console (not the Wii U or 3DS) in ""emerging markets"""
82,Agave plant can produce diabetic-friendly sweetener: Study
83,'X-Men: Days of Future Past' merges old and new
84,Gregg Allman film director indicted after fatal on-set crash
85,"Emmys recap: Modern Family, Breaking Bad win big while Robin Williams"
86,Judge leaves Internet radio giant Pandora songwriter royalty unchanged
87,Ford Mustang to climb Empire State Building - again
88,Jimmy Fallon's monologue writer Jon Rineman back in Boston
89,Charlie and Snoopy return in 3-D film
90,Fed cuts growth forecast as taper continues
91,Please Let This New Harry Potter Short Story Be the Last
92,Hedging $150 Billion Yuan Bets in Focus on Swings: China Credit
93,Fitch affirms Nigeria at 'BB-'; Outlook Stable
94,Eric Hill Got the First One-on-One Date With Andi Dorfman on The Bachelorette
95,"US STOCKS-Futures point to higher open, S&P 500 near record"
96,"Review: NPH's “Hedwig” Tears Down Walls, the House"
97,Red Hat Acquires Cloud Services Provider eNovance
98,Pandora (P) Price Increase Seen Supporting Subscription Service - Goldman
99,Samsung S4: The winner takes it all
100,Asian shares start week with drop
101,Case-Shiller sees housing market cooling ever so slightly
102,URGENT - ebola outbreak
103,Orange Is the New Black Season 2 Trailer: Next Level Crazy For Litchfield
104,"Rob Kardashian tweets prayers, Bible verses after skipping his sister's wedding"
105,"Madigan: Companies ""Preyed"" On Student Loan Borrowers"
106,James Maslow does the tango with Cheryl Burke on 'DWTS' 2014
107,Scientists blame neonicotinoids insecticides for mysterious disappearance of
108,Lindsay Lohan's reality show off to a so-so start
109,VIX up as equities hit new heights
110,InFamous: Second Son and the superpowers we'd like to see in gaming
111,US Economy Rebounds In Spring With GDP Expanding At 4 Percent Rate
112,US Fish and Wildlife Service lists lesser prairie chickens as threatened
113,'Bears' finally claws its way to the big screen
114,"E. coli outbreak linked to sprouts; hummus, dips, walnuts recall - 12 News KBMT"
115,Special Report – 2014 Mid-Year Review And Outlook
116,China investigating Microsoft over Windows anti-monopoly claims
117,"Actor Eli Wallach, Who Brought Hint Of Humanity To Villainous Roles, Dies"
118,New mums pose naked for magazine shoot
119,U.S. Home Price Growth Continues To Slow In May
120,"Drink up, NYC: Ban on big sodas is canned"
121,France says BNP Paribas' $10b US fine 'unreasonable'
122,"'We're staying!' No, they're not: Jenny McCarthy jokes about departures from 'The"
123,'The Bachelorette': 7 Reasons Nick is the Wrong Choice for Andi
124,Gwen Stefani returns to stage after third child
125,Miley Cyrus and Avril Lavigne filmed a fun Instagram video in Toronto
126,Hip Hop Rumors: Solange Breaks Her Silence!
127,"It's never too early to start reading aloud to your kids, doctors say"
128,VIDEO: Astronauts practice their footie skills aboard the International Space Station
129,'Dad.... A few questions' - the full text of the email Bindi sent her father Rolf Harris
130,Experimental new drug offers promise in fight against measles
131,Kimye jet to Ireland for secret honeymoon
132,Obama administration tightens coal dust rules to reduce black lung cases
133,"Kanye West and Pharrell Williams, Wireless Festival, review: deserving of boos"
134,"'The Voice' Adam Levine and Cee Lo Movie, After Drugs Arrest and Pharrell"
135,Facebook admits bad communication on news feed emotion study
136,"GM offers bonus to dealers to speed up recall, repairs"
137,Pilot error to blame for crash of Asiana flight 214
138,SunTrust Banks Inc. agrees to pay $968M to settle mortgage cases with US
139,"Michael Jackson's iconic, troubled legacy"
140,Murphy's final film to be released
141,"EUR/GBP Fundamental Analysis August 26, 2014 Forecast"
142,Stop monkeying around! San Francisco cracks down on Monkey app that allows
143,For better or worse: Your guide to Oculus internet arguments
144,Your comments: Time Warner Cable 'messed with the wrong people' during 'The
145,Rob Kardashian Cuts Off Communcation With Kim Kardashian And Khloe
146,How to bring a bit of happiness into your life
147,Target to Tell Congress It's Exploring Its Slow Hack Response
148,US Economic Growth For Q4 Is Revised Slightly Up
149,'Bullets Over Broadway': Theater review
150,Hong Kong Stocks Swing Amid US Job Gains; Cnooc Drops
151,Walking Dead Season 5 Spoilers: Rick Breaks Out of Train Car A - Terminus
152,Grieving Jagger 'struggling'
153,Samsung confirm Galaxy S5 camera fault
154,Filipino nurse tests negative for MERS coronavirus: RITM
155,Kim Kardashian & Kanye West To Live Apart?
156,"Forex - Euro edges higher, gains checked after German Ifo"
157,See how Brad Paisley responds when Westboro Baptist Church protest his concert
158,This Dinosaur Skeleton Proves The Biblical Flood Happened 4300 Years Ago
159,China JD.com raises US$1.78b in US IPO
160,Nyong'o is 'Most Beautiful'
161,'The Walking Dead' season 4 finale spoilers: Could Terminus be full of cannibals?
162,Apple trying to patent gesture unlock method that's dangerously close to Android
163,Look Who Brought Their Boyfriends To Taylor Swift's Epic Fourth Of July Party
164,"Yahoo's Mayer not ready to scoop up AOL, says report"
165,NASA's Low-Density Supersonic Decelerator (LDSD) Test Flight a Huge Success
166,"Pat Robertson: If Mozilla CEO Was Wrong, 'Then God Almighty is a Hater'"
167,Domino's France Will Not Pay Hacker Extortionists
168,Microsoft loses consumerization champion with Tony Bates resignation
169,Calling all geniuses for the new Longitude Prize
170,"Bryan Singer abuse case: He wasn't there, says lawyer"
171,"Fast Food Protests Fall Flat, Again"
172,Is the Affordable Care Act Working?
173,Vancouver's Lululemon says it's getting its mojo back as fourth quarter revenue
174,"3300-year-old tomb with pyramid found, Abydos burial ground"
175,Potato salad project raises $37K on Kickstarter
176,3300 year old tomb and pyramid entrance unearthed in Egypt
177,GoPro soars on first day of trading
178,Jet-Lag App Helps Get Circadian Rhythms Back On Track With 'Schedules' Of
179,Use eBay? Might wanna change that password...
180,Researchers using math to whittle away at jet lag
181,"Apple, Samsung due in court again amid patent dispute"
182,Researchers discover lost species of nightsnake in Mexico
183,Chris Pratt embarrassed by weight at auditions
184,How will the LG G3 hold up to other flagships?
185,Should you eat Taco Bell's waffle taco breakfast?
186,Standard & Poor's downgrades SA
187,Best Buy says hot new products are needed to spur sales growth
188,T. rex gets a new home in Smithsonian
189,Freddie Mac Announces Settlements Totaling Approximately $5.1 Billion With
190,Expert cites driver fatigue in train crash
191,Pilot 'mismanagement' probable cause of San Francisco Asiana plane crash
192,Amazon readying a 3D smartphone
193,"16GB iPod touch gets new colors, iSight camera and price drop"
194,Explorer Creates Record By Living Undersea For 31 Days
195,Girl Power: Marvel Comics Announces First Female Thor
196,Chris Pratt stars in new photo from 'Jurassic World'
197,Disney Honcho Alan Horn Says 'Star Wars: Episode VII' is Already Shooting
198,Woman abandoned as baby in Burger King tracks down mother after 27 years
199,Queen To Release New Album With Unheard Freddie Mercury Vocals
200,United Nations health agency warns of MERS virus threat to pilgrims ahead of
201,RIP GWAR's David Brockie
202,"Pregnant Ciara and Fiance Future Celebrate Baby Shower, La La Anthony and"
203,"Supreme Court Rules on Cell Phone Searches, Internet Streaming"
204,Documents released say General Motors waited years to recall 335000 Saturn
205,"Netflix & Level 3 Only Telling Half The Story, Won't Detail What Changes They"
206,Our Opinion: Distracted driving ad brings risk into focus
207,Robert Pattinson Still Reportedly Stays In Kristen Stewart's Home When she's
208,Microsoft adds splash of colour with first Nokia ad
209,Disney Channel Star Zendaya to Portray Aaliyah in Lifetime Biopic
210,"Samsung's 28-inch, billion-color, UHD 4K display up for pre-order for less than"
211,'The Walking Dead' channel Disney characters with epic results
212,Update: Microsoft pulls crippling patch from Windows Update
213,"Ringo Starr Looks Back on 'A Hard Day's Night': 'It Was Mad, But It Was"
214,"Katie Holmes: “When I Became a Mother, My Life Completely Changed”"
215,Study: Pregnant Women have More Car Crashes in 2nd Trimester
216,"Quick Hits: Puff Daddy, Passenger, Becky G & Katy Perry, MIA, Wolfmother"
217,"GE, Siemens defend rival plans for France's Alstom"
218,Domestication Syndrome: Your Pet's Cute Features A Result Of Genetic Deficit
219,Justin Bieber briefly detained at LAX by customs
220,ABC v. Aereo: What The Supreme Court Decided - And What It Did Not
221,Google X begins Baseline Study to find illness as early as possible
222,A Blank Profile Is Probably as Good as Whatever You Wrote on OkCupid
223,"Germs on a Plane: Bacteria can linger for days, study finds"
224,Conan O'Brien says Stephen Colbert is the 'right person' to do 'Late Show'
225,Is Chad Kroeger's suckiness rubbing off on Avril Lavigne?
226,Chikungunya Virus Makes its Way to US Virgin Islands
227,"Medtronic buys Irish company, gets much lower tax bill"
228,Polio Has Been Declared an International Public Health Emergency
229,Home»News»Business»Applications for US jobless benefits fall to 302000; 4
230,Thailand deeply concerned over rising number of Mers cases worldwide
231,Ice Bucket challenges flood area (with VIDEO)
232,Apple's iWatch Mystery Continues with Korean Trademark Filing
233,"Google announces Android One, a low-cost smartphone program"
234,Area man continues to collect iconic toys from his childhood
235,Australia men have third best life expectancy in the world whereas its women
236,UK's FTSE falls for 2nd day; Air France warning hits airlines
237,"Apple, IBM tie up to tap global enterprise mobility market"
238,US consumer confidence slides in March but remains largely intact after frosty
239,L'Wren Scott's social media profiles have been taken down.
240,Jessica Alba's Company Valued at Nearly $1 Billion
241,Fleetwood Mac coming to Calgary
242,7 warm-weather health myths debunked
243,Game Of Thrones sees Danaerys takes on another slave city
244,"ABC's McFadden to NBC, Chang to anchor 'Nightline'"
245,ANIMAL KINGDOM Helmer to Write And Direct THE OPERATORS With Brad Pitt
246,Treasuries Slip As Durable Goods Orders Climb
247,"Barclays 'may slash 7500 investment bank jobs', says broker"
248,Larry Kramer's 'The Normal Heart' Paints Outrage That's Still Relevant
249,Report: China pushing banks to abandon American hardware
250,ReWalk's aid for paraplegics wins FDA approval for personal use
251,"2014 James Beard Award finalists announced, with several nods to New"
252,Federal safety regulators expand ignition switch and air bag probe to Chrysler
253,Stars flocking to Costume Institute Gala at the Met Monday night
254,The purpose of the giant 'Batman v Superman' Superman statue revealed
255,Supermassive black hole trio discovered
256,Nike Fires Members of FuelBand Team to Focus on Fitness Software
257,'Neighbors' forces 'Spider-Man' to move out of top box office slot
258,All USB devices vulnerable to serious security issue – no fix
259,Apple's Maps App May Have Helped Discover the Loch Ness Monster
260,Phoenix students compete at White House Science Fair
261,Airline suspends flights over Ebola fears
262,Settlement reached over Mickey Rooney burial
263,"Walgreens Misses on Q3 Earnings, Fresh Fiscal 2016 View Awaited - Analyst Blog"
264,Crude Oil Prices Remain High as Iraq Drives Markets
265,Free meals all summer for kids 18 and younger
266,Dave Chappelle has a 'Kanye moment' with Jimmy Fallon
267,New meteor shower could offer spectacular show starting Friday
268,Deficit dips; long-term federal budget outlook remains dim
269,iPad Air vs Galaxy Note 8.0: Can A Pen Make A Difference?
270,"IMF may slash global growth forecast, says global economic recovery to"
271,Kevin Bacon recreates Footloose dance for Tonight Show; remains an utterly
272,"New, highly sensitive DNA test can lead to faster, more accurate cancer diagnosis"
273,'True Blood' clip teases final season
274,E-Cigarette Ads Targeted Toward America's Youth Increased By Over 250
275,Samsung working on smartwatch that will make calls: Reports
276,Instagram update lets users edit their photos even more
277,Who is Oscar Isaac? Six notable facts about the newly appointed Star Wars
278,Two Incredibly Lucky Women Survive After Train Runs Over Them On Bridge
279,BEIJING: Girlfriend of missing American writes to him online - WNCN: News
280,Sum 41's Deryck Whibley: Booze Nearly Killed Me
281,"Jimmy Fallon, Seth Rogen And Zac Efron Are Selfie-Obsessed Teenage Girls In"
282,An anonymous millionaire is hiding cash around San Francisco
283,Mexican restaurants squeezed by surging lime prices
284,PR Newswire
285,Mumps Outbreak Reported at College
286,Chrysler Issues Reply to NHTSA Call for Speedy Hitch Installation
287,eBay Urges To Reset Passwords After Breach
288,Priceline gets into restaurant business by buying Open Table for $2.6 billion
289,"One in three cases of Alzheimer's worldwide potentially preventable, new"
290,Frankie leaves the House for the last time
291,Antarctic ice sheet 'past the point of no return'
292,"Assisi Jackson, Mick Jagger's granddaughter, gives birth to baby girl"
293,Billboard Music Awards 2014: Red carpet arrivals
294,Raiffeisen Bank Int'l expects profit in Romania in 2014
295,"Apple, Google Agree To Settle Longstanding Patent Dispute"
296,Touching tribute to Cory Monteith by girlfriend one year on
297,General Motors to Focus on Safety - Analyst Blog
298,Pre-Market: Amazon Faces Potential FTC Lawsuit; US Adds 288000 Jobs in June
299,Google Chromecast prepped for UK release
300,GM recalls more vehicles
301,"Rowling: Harry Potter married, going grey"
302,"US teen birth rate at historic low, but girls deliver 1700 babies every week, CDC"
303,Scientists Just Found Stray Vials of Smallpox from the 1950s
304,Pretty Little Liars Clips: What Did Hanna Forget? What Did Spencer Know?
305,"$4 billion: Bogus tax refunds a growing problem, feds say"
306,Just 2% of Wisconsin corn crop in the ground
307,Katie Holmes' August Glamour Cover-Shoot
308,Will $15 shills really help Google overtake Microsoft Office?
309,"Bank of America, Ex-CEO Ken Lewis fined $25 million by New York State for role"
310,Frostie the Snow Goat melts hearts everywhere
311,Ukraine in talks with IMF for loan
312,Much for Vivendi to ponder in bids for its telecoms unit
313,"Australia, Japan strike trade deal"
314,Benzinga's Top #PreMarket Losers
315,Priceline Buys OpenTable For $2.6-Billion
316,"HR Giger, the man who designed Ridley Scott's Alien, dies in fall at home"
317,"At China's Alibaba, chairman Ma's dealings raise red flags"
318,Cupcake shop Crumbs' demise shows dangers of focusing on single product
319,Murdoch Sons Take New Positions at 21st Century Fox
320,"Brooks: ""For us it is five shows, or none at all"""
321,American Idol Recap: Who's Going Home?
322,Facebook introduces blue cartoon dinosaur to explain recent privacy changes to
323,India June factory activity picks up at fastest pace
324,New Details Emerge About Mary Jane's Deleted Scene In The Amazing Spider
325,London pre-open: FTSE set to jump after Federal Reserve meeting
326,New 'sober' smartphone app sounds alert when you get to close to a bar
327,Feds: Obamacare Enrollment Tops 5 Million
328,Google Details Workaround to Devs Looking to Sell Android Wear Apps
329,Neil Patrick Harris becomes emotional on series finale
330,Gasoline Price Update: Unchanged
331,"iPhone 6 release date September -- including big phablet, say sources"
332,News Minute: Here is the latest news from The Associated Press
333,In the World
334,O'Reilly Hits Back at Colbert as 'Darling of the Far Left' and 'Ideological Fanatic'
335,Ebola Virus Outbreak in Africa: Transmission and Symptoms
336,Yuma reports its 1st West Nile case in '14
337,Pfizer walks away from £69bn AstraZeneca takeover bid
338,Moves can now share your info with Facebook and the police
339,"Lawmakers must tackle Chicago pensions - WGEM.com: Quincy News, Weather"
340,"Rob Kardashian Still Not Speaking with Khloe and Kim Kardashian, Therapist"
341,Tesla Open Sources Electric Car Tech
342,Former NFL star Michael Strahan says hello to 'Good Morning America'
343,Kanye West and Kim Kardashian's Vogue Cover Story Previewed
344,Lea Michele frustrated by constant Naya Rivera rumors
345,Sony Officially Details PS4 Update 1.70
346,Sequel to new Denzel Washington film in development
347,CBS Outdoor prices IPO at $28 per share
348,U.S. consumers still wary despite stronger job market
349,JK Rowling publishes a story about a 34-year-old Harry Potter 7 years after the
350,"How to Prevent, Detect, 'Cure' Breast Cancer - Salako"
351,Ocearch Scientists make startling new discovery on great white sharks
352,Ultimate Perfectionist Kanye West Took FOUR Days To Choose The Perfect
353,Sandra Bullock's chilling encounter with 'stalker'
354,Pulitzer Prize Winners Announced
355,"Samsung Renews Relationship With Google, Android With Launch of Gear Live"
356,Voodoo dolls shed light on domestic spats
357,"Stained Michael Jackson chair goes up for auction on eBay, estate made $700"
358,"Batman Vs Superman Wonder Woman Action May Have Already Ended,New"
359,There's no time like present to get on the housing ladder
360,A New Novartis Heart Failure Drug Might Be A Blockbuster
361,Jill Abramson Talks 'Resilience' at Wake Forest
362,How Did David Brockie Die? GWAR Frontman Dies From Drug Overdose
363,Microsoft to Launch Xbox One in China on September 23
364,Inmarsat to Offer Basic Tracking Services for Planes After MH370 Loss
365,'The Expendables 3′ Cast Wants to 'Bring Back Our Girls'
366,"Sprint's Virgin Mobile Custom offers to buy back unused minutes, texts and data"
367,'Jeopardy!' winning streak broken by Scituate man
368,Failed Alstom bid rocks MHI's global strategy
369,Metro-North employee killed by train in Manhattan
370,Paul McCartney Animated Film a “Go” as Rocker Resumes Tour After Illness
371,Nintendo to introduce game console for emerging markets in 2015
372,Mike Mayo Called for BNY Mellon Shakeup in April
373,Netflix to Pay Verizon for Faster Access to Broadband Network
374,"Google is No. 1 on list of 25 companies with the best perks and pay, survey says"
375,"China profits boost Asia stocks, Europe unenthused"
376,Russia boosts military; global arms investments dip
377,"Active Stock In Activity- Staples, Inc. (NASDAQ:SPLS), Target Corporation"
378,US Futures Point to Higher Open as ADP June Payroll Jump Encourages Market
379,Gas Prices Top $3.80 in Many Large States
380,HTC seeing acquisition of Nokia's Chennai plant
381,"Netflix Well-Positioned To Combat Threat From Apple, Net Neutrality Ruling"
382,The latest dumb teen 'trend' is smoking coffee
383,Report: Marijuana Eases MS Symptoms
384,Western wildfires keep getting worse — and climate change is a prime suspect
385,Microsoft's Bing Offers Users A Chance To Be Forgotten
386,Kaley Cuoco's life changed after dating Superman
387,Google Chrome takes big chunk of commercial notebook sales
388,VIDEO – Dean McDermott admits on camera to cheating on wife Tori: “Sex was
389,"In Light of High Frequency Trading Lawsuit, Big Banks Pull Away from Barclays"
390,NC Population Growth
391,"Bezos' Letter to Amazon Shareholders Covers Groceries, Drones"
392,Pataky shares first picture of her twins with Chris Hemsworth
393,TeliaSonera to Buy Tele2′s Business in Norway
394,ICJ orders Japan to end whale hunts | Bangkok Post: news
395,10 Times Allison Williams Already Looked Like Peter Pan
396,Fixed Mortgage Rates Ease in Mid-April
397,Three charged in US$33M art scam
398,BBM Can Be Downloaded Now On Windows Phone
399,The Notebook director: Ryan Gosling and Rachel McAdams despised each
400,Inexpensive Food A Key Factor In Obesity Epidemic
401,"First Trailer For Jersey Boys, Clint Eastwood's Film Of The Stage Smash"
402,Adele's tweet sparks album-release speculation
403,"PS4 Outsells Xbox One, Even After Price Drop"
404,Number of job openings at highest level since 2008
405,Amazon vows to fight FTC on kids in-app purchases
406,The Quest to Kill Snapchat Won't Mean Much for Facebook Stock
407,"Tourists In Thailand Say, 'What Coup?' [PHOTOS]"
408,Microsoft CEO Nadella chuffed as Office for iPad hits top spot on App Store
409,The three pillars of faith
410,FDA approves electric headband to prevent migraine
411,For Good Or For Ill: 10 Predictions For The Future Of The Internet
