catalog_id,text
2057,The Captain keeps his charm
2058,"Google Snags Songza, But Will Streaming Ever Be Profitable?"
2059,Mysterious island appears on Saturn moon
2060,"'Glee' star Lea Michele not pregnant, Twitter account was hacked"
2061,Android 5.0 Lollipop Homescreen Images Leaked
2062,High BP is a silent killer too: Experts
2063,"Lea Michele Is Pregnant?! Nope, Just the Latest Glee Star Hacked"
2064,Kerry tries to repair damage in US-India relations
2065,Iranians arrested over Happy video
2066,Wall Street closes mixed
2067,Xbox One July Update Brings Snap Mode For Achievements
2068,CBS's (CBS) CEO Leslie Moonves on Q1 2014 Results - Earnings Call Transcript
2069,Morgan Freeman: 'Transcendence' a horror film?
2070,The Cricket's Daily 3: Pope Francis is not part of 'Noah's' marketing campaign
2071,Hayden Panettiere expecting first child with fiance Wladimir Klitschko
2072,An African Ebola Epidemic Is Now the Most Deadly Ever — And It's Getting Worse
2073,Apple TV price cut makes streaming box £79
2074,"Wondercon 2014: Warner Bros.' 'Edge of Tomorrow,' 'Godzilla,' and 'Into the Storm'"
2075,So Much Better Than Clippy: Google Now Comes to a Desktop Near You
2076,How to Tell If Your ThinkPad is Affected by Battery Recall
2077,Plan is offered to solve medical custody dispute - CBS 3 Springfield - WSHM
2078,Apple loses lawsuit against Chinese regulator over patent rights
2079,"Got a rash? iPad, other devices might be the cause (Update 2)"
2080,George R. R. Martin dismisses doubts he won't finish 'Thrones'
2081,Facebook courts journalists with newswire tool
2082,'Seinfeld's' First Season Would've Still Beaten Today's Top Show
2083,"Kate Middleton, Duchess Of Cambridge's Hot Pink Goat Dress Sells Out In Hours"
2084,India Is Polio-Free After Three Years with No New Case
2085,OkCupid's President on the Site's Social Experiments: 'Most People Don't Care'
2086,Big Brother 2014: First Eviction of BB16 Recap with Ian Terry
2087,Savers beware: Fees may shrink your 401(k)s
2088,Sitcom Actors Preparing For Divorce
2089,"Aw, Jeez! Fargo Series ""Too Good"" for Stars to Pass Up"
2090,Remote-controlled contraception sounds amazing but is it susceptible to hacking?
2091,'Field of Dreams' town prepares for anniversary party and visits from actors
2092,Governor urges building of more pipelines to carry North Dakota oil
2093,New 'Meteor Storm' from Comet May Light Up Night Sky This Month
2094,Testing Underway After Water Leak At Site Of West Virginia Chemical Spill
2095,KATHLEEN PARKER: Why can't Rush take a joke?
2096,Allergen Rejects Valeant Offer
2097,US consumer confidence moved up in May
2098,"Pride Parade draws stars, thousands to downtown Seattle"
2099,Hugh Jackman excited about Broadway return
2100,Speculators Dump the USD
2101,Fiat-Chrysler Moving Global HQ to London
2102,"4th Bailout Review Is Positive, Cyprus Says"
2103,Speculation thins in absence of profit windows
2104,"Poughkeepsie-bound Metro-North train strikes, kills railroad employee on tracks"
2105,Apple's New Texting Idea Means You'll Never Have to Look Up from Your Phone
2106,Do you want to make a deal? Like a Rolling Stone manuscript sold at auction
2107,Orphan Black season 2 episode 4 preview
2108,"Market Movers: Tesla Motors Inc. (NASDAQ:TSLA), Ford Motor Company (NYSE"
2109,Selena's folks not happy about her Bieber reconciliation
2110,Morgan Stanley's CEO gets a 100% raise
2111,The truth behind 'The Other Woman' (VIDEO)
2112,Switzerland launches investigation into top global banks for currency manipulation
2113,'True Blood' recap: Sookie risks everything to save Bon Temps
2114,Home-Builder Confidence Moves Positive for the First Time Since January
2115,Drake Sang Two Fake Songs At The ESPYs And They Could Probably Both Turn
2116,Five Interesting Things in the Box IPO Filing
2117,Airlines to discuss post-MH17 flight routes
2118,Gov. Bill Haslam touts Tennessee's innovative education policies
2119,Ray J Gives Kim K worst wedding gift possible
2120,"Search For Trapped Miners In Honduras Continues, Three Miners Rescued"
2121,Stocks rise on strong retail sales reports
2122,Weight-Loss Blogger Claims Shape Magazine Tried to Censor Her 'After' Photo
2123,"In Europe, Samsung's Galaxy S5 Comes In Behind Apple's iPhone"
2124,Museum Board Meets Regarding Sinkhole Fate
2125,Steroid Injection for Chronic Back has Little Benefit; Study Finds
2126,"Beef Prices Spiking High, Some Consumers Switching To Pork or Chicken"
2127,Kill switch could be standard on smartphones by 2015
2128,"Firefox OS 1.3 arrives with dual SIM support, continuous autofocus, flash, smart"
2129,Sales of new US homes plunge 14.5 percent
2130,Mashable: Gang of cyber criminals on the run in Ukraine and Russia
2131,VIDEO: First Trailer for THE HOBBIT: THE BATTLE OF THE FIVE ARMIES Has
2132,Apple agrees to pay $450M to settle e-books case
2133,Jamie Foxx puts a charge into 'Spider-Man 2'
2134,Megan Fox Finds Difficulty Juggling Work And Her Family
2135,The moment two women trapped on railroad bridge escaped death after diving
2136,Spain's jobless rate rises in first quarter of 2014
2137,The Tinder Dating App Might Be Worth $5 Billion (UPDATE: Or Not)
2138,EasyJet cuts loss expectations and forecasts rising revenue
2139,Heartland Releases More Hogwash Ahead of IPCC Climate Change Report
2140,US STOCKS-S&P 500 posts worst day since April; indexes down for month
2141,Apple's (AAPL) Alliance With IBM A Major Frontal Assault On Microsoft's (MSFT
2142,Sony Forms China PlayStation Venture in Microsoft Challenge
2143,The iHeartRadio Ultimate Pool Party Will Be Available As A Livestream
2144,FLY GIRL: Megan Fox GETS FAB FOR AUGUST COSMOPOLITAN AUGUST 2014
2145,Barclays to cut 14000 investment jobs
2146,Halo 5: Guardians release date set for fall 2015
2147,What is discouraging HIV testing among at-risk populations?
2148,Why You Should Care About Net Neutrality
2149,"Reports: Microsoft Surface Mini to feature ARM CPU, stylus support"
2150,'The Walking Dead' season 4 finale sets another ratings record
2151,How unemployment in Oregon compares to the rest of the nation: Oregon & the
2152,Lily Allen to join Miley Cyrus on tour and bring parents' nightmares to life
2153,Brad Pitt throws beer to Matthew McConaughey from balcony
2154,"Study finds little benefit, some harm from steroid shots for back pain"
2155,Chemists Expand Nature's Genetic Alphabet
2156,"Google's search proposals 'not just a moneyspinner', says Europe's competition"
2157,Oscar Pistorius trial: Manager tells court about Paralympian's 'loving' relationship
2158,'Lung cancer won't stop me cycling'
2159,Courtney Love Hopes She Found the Malaysia Airlines Plane
2160,Chris Brown Trying to Pay Off DC Accuser to Avoid Probation Violation?
2161,Scientists discover evidence for universe's early growth spurt
2162,Mariah Carey is focused on Asian tour
2163,China PMI Index Hits New Heights
2164,"Transcendence, film review: Johnny Depp's sci-fi thriller transcends bad reviews"
2165,NASA To Launch Global Warming Satellite
2166,Bag ban heads back to council for vote Wednesday
2167,Swell. Apple buys 'Pandora-for-talk-radio' app... for $30 meeellion
2168,'American Idol' Season 13 Top 3 Predictions: Who Will Be Sent Home? Who Will
2169,A celebration of Beyonce's costumes on her tour with Jay-Z
2170,Malaysia Airlines Flight 370 searchers hear another possible black box ping
2171,"'Scandal' Season 3 finale recap, 'The Price of Free and Fair Elections'"
2172,Zac Efron threatens to make another High School Musical
2173,Math may help whittle away jet lag
2174,"Peaches Geldof Funeral Set, But We Still Don't Know How She Died"
2175,'Long Story Short': A Brief History Of How HBO's 'Game of Thrones' Came To Be
2176,Head On Over to Germany to Check Out a Live Replica of Vincent van Gogh's
2177,Gwen Stefani Confirms She's Officially Joining NBC's 'The Voice'
2178,Stocks Finish Higher on Stimulus Chatter; Tech Shares Rally
2179,Does ocean on Pluto's giant moon harbour life?
2180,Quintuplets Born 8 Weeks Premature Doing 'Remarkably Well' (VIDEO)
2181,Monarch Butterflies may Have Magnetic ompass
2182,YouTube Is Adding Crowdfunding and a Channel Management App…
2183,Outsized Gains Driven By Fun-Duh-Mental Strength
2184,"Robin Thicke's Twitter Q&A session went horribly, amusingly wrong"
2185,Teaser Picture for the 'Batman vs. Superman' Batmobile
2186,Gold weakens after World Gold Council report
2187,Chikungunya Piggybacks to Rhode Island
2188,Apple Snaps Another Industry Executive for the iWatch
2189,"Kanye West Calls Himself A Rock Star, Hits Out At Press At Bonnaroo"
2190,Astronomers Create First Realistic Virtual Universe
2191,5 most anticipated features in the iPhone 6
2192,Disney Parks Celebrate 50th Anniversary of “it's a small world”
2193,"Baby Gorilla Born Last Week Has Pneumonia, Expected to Recover"
2194,President Obama To Help Launch Fox's 'Cosmos' Show Tonight
2195,Nasdaq composite falls most since 2011 amid tech sell-off
2196,"Work Environment may be Less Stressful than Home, Particularly for Women"
2197,2015 Chevrolet Cruze Interiors Revealed
2198,Barbara Walters retires after an illustrious career
2199,Google Inc (GOOG) news: Android Wear: The Smartphone-Centric Smartwatch
2200,"Amazon.com, Inc. (NASDAQ:AMZN) Not Ready To Give In FTA's Demand Of"
2201,Miley Cyrus's Bangerz tour bus exploded in flames
2202,Autism at school: how teachers can help
2203,HBO GO Crashes For True Detective Finale
2204,We're Not Sure How to Feel About This Miley Cyrus and Flaming Lips Cover of
2205,British inflation rose sharply in June
2206,Horseless Carriage Champ Bully-Whips Female Photographer
2207,Kevin Bacon 'Footloose' Dance On 'Tonight Show' Hilarious! Watch Video Of
2208,US manufacturers expanded in June but more slowly
2209,Gulf Airlines Raise the Stakes in Luxury
2210,Google Inc (GOOG) adds new features to AdWords
2211,Canadian Economic Growth Lags Forecasts in April on Energy
2212,Why Did Kate Winslet Name Her Baby Bear Blaze?
2213,'Phenomenal woman' Maya Angelou dies
2214,Officials Defend Decision to Let Baby Eagle Die on Webcam
2215,Read Kim Kardashian's Twitter wedding rant
2216,Facebook's Virtual Purchase Is Very Real
2217,JAY Z's MADE IN AMERICA Festival to Expand to LA in 2014
2218,Oculus Rift News: Ford Has Used Facebook's Latest Acquisition To Design
2219,Japan Says Vietnam Boat Sinking 'Alarming'
2220,US 30-year mortgage rate up to 4.33 percent
2221,The machine rises in 'Transcendence'
2222,GM's US recall proves challenging
2223,T-Mobile Music Freedom: streaming without touching your data quota
2224,Andy Serkis is changing the face of film-making
2225,Insane Rumor Of The Day: Bradley Cooper To Be The New Indiana Jones
2226,Toyota Expected to Pay Out $1 Billion to Settle Probe
2227,'Mad Men' and the greatest character exit in the history of television
2228,Tunnel machine won't dig for nearly a year in Seattle
2229,Megan Fox & Cameron Diaz Get Sexy on August Covers!
2230,Is this Leonardo DiCaprio busting some insane dance moves in the crowd at
2231,"Google Misses Q1 Earnings Estimates, Stock Drops More Than 5%"
2232,Barclays gets a US$44 million fine over gold fix
2233,Emirates cancels 70-plane A350 order worth $16bn
2234,Four Ebola cases confirmed in Guinea's capital: medical sources
2235,Star Wars 7 video: First footage from Episode VII set revealed by JJ Abrams
2236,"French group files privacy suit against Facebook, Twitter"
2237,The CEO Of Oculus: We're Going To Be Worth Way More Than $2 Billion
2238,Samsung Says $2 Billion for Apple Patents Is Too Much
2239,"Oracle Wins Appeal In Google Android Suit, Court Rules It Can Copyright Java"
2240,Mandy Moore steps out with fresh look... just hours after hitting Johnny Depp and
2241,"Have your say: Apple CEO Tim Cook labels worrying iPad sales slump ""a speed"
2242,Venture capital funding soars to levels last seen in dot-com bubble
2243,"Ahead in polls, medical marijuana holds high ground in ad war"
2244,The IPO Window Shut?
2245,Apple iPhone 6 screen snag leaves supply chain scrambling
2246,Gov. Jerry Brown signs repeal of restaurant 'glove law'
2247,Game of Thrones Recap: People Who Need People
2248,LG G3 Press Render Surfaces With Verizon Branding
2249,Ohio mumps outbreak grows
2250,New photo of 'Fifty Shades' male star released
2251,Major U.S. Airlines Tote Up Effects of Winter Storms
2252,Consumer profiling: Data brokers know more about you than your mom or Google
2253,Some families filing claim against Boeing and MAS over MH370
2254,Here's Your Complete Preview Of This Week's Big Economic Events
2255,Why Elon Musk's enticement stunt might just work out
2256,Four Things You Need To Know About Disney's Drones
2257,Gas prices remain near national average of $3.64 per gallon
2258,Inequality Myths
2259,'Game of Thrones' recap: After the Red Wedding
2260,Nobel Laureate Gordimer Dies
2261,Facebook Buys Oculus Rift VR Company for $2Bn
2262,"Two shows, 'Community' and 'Reading Rainbow,' could see resurrections thanks"
2263,Sir Mick Jagger - L'wren Scott Honoured By Charity
2264,Alzheimer's Society and Public Health England launch Dementia Friends TV
2265,"Report: Kansas, Missouri hospitals rank high among top US facilities"
2266,"Friends Are As Genetically Similar As Fourth Cousins, Study Says"
2267,Studio apologises for Turtles gaffe
2268,James Gunn discusses Edgar Wright's Ant-Man departure
2269,Emma Stone joins the star cast of Woody Allen's next film
2270,Electronic cigarette industry awaits looming FDA regulation
2271,"Breaking news: Pistorius not mentally ill during killing, panel reports"
2272,Hyundai recalling 1 million Sonatas
2273,Jonah Hill Issues Emotional Apology for Anti-Gay Slur
2274,Stepping forward: The real Colbert
2275,'The Bachelorette' 2014 Spoilers: What Will Happen In Episode 8? News Of Eric
2276,This Sensual R&B Version of the DuckTales Theme Song Will Be Your Favorite
2277,"Ebola outbreak in Guinea an 'unprecedented epidemic', MSF says (Update)"
2278,Caroline Ruscak of Massachusetts gives Newborn baby weighs in at 14lb 5oz
2279,Bad WWE TV Deal Costs Vince McMahon $350 Million; Bid To Buy Clippers on
2280,Driverless cars sidestep cyclists
2281,They're Back! Craig Zadan And Neil Meron Will Produce 2015 Oscars Following
2282,Intel's new Core M chips turn PC processors tablet-friendly
2283,US Government Investigates Recent Worker Deaths at Amazon Facilities
2284,"General Motors Recalls Another 7 Million Vehicles, Some Dating Back To 1997"
2285,"Dogs' Smell is Early Detection for Prostate Cancer, Study Finds"
2286,Chappaqua Reacts To 30-Percent Spike In Autism Prevalence
2287,Missing Malaysia plane: Chinese satellite finds object near jet search area
2288,"Happy Hour: New MJ album, SNL's Black Jeopardy, 'Walking Dead' finale, more"
2289,Kim Kardashian Hollywood Video Game Launched on Apple Store and Google
2290,Researchers Find NSA Planted Two Spy Tools through RSA
2291,Selena Gomez's Parents: Vehemently Opposed to Justin Bieber!
2292,"Hewlett-Packard Co, shareholders settle suits over Autonomy deal; agree to"
2293,Guinea confirms Ebola as source of epidemic
2294,China trade surplus rises to US$18.45 billion in April: Customs
2295,"China Mobile annual profit falls 5.9 percent on higher spending, intense"
2296,Sharknado returns to TV Wednesday night with 'Sharknado 2: The Second One'
2297,Stem cell scientist calls for retraction of study
2298,Govt to pay in case of an epidemic
2299,Feds to cut road payments at peak summer driving season
2300,"Hot Dogs, Salami May Raise Men's Heart Failure Risk, Study Suggests Read"
2301,Woman who MADE UP entire bestselling holocaust memoir is forced to pay back
2302,Why women go for double mastectomy even when they don't need it?
2303,Maksim Chmerkovskiy and Meryl Davis: The truth behind their relationship is out
2304,Trace Adkins Getting Divorced After 16 Years Of Marriage
2305,Oakland Tribune editorial: Santa Barbara slayings revive mental health issues
2306,UPDATE 2-Wesfarmers exits insurance with sale of broking unit to US insurer
2307,The 2016 Smart ForTwo Stays Small But Gets Huge Improvements
2308,"Techniques used to grow vaginas, noses and ears in labs may be useful for"
2309,"'Seinfeld' star Wayne Knight is not dead, jokes he needs a death hoax to trend"
2310,TradeTheNews.com US Market Update: Equities Close Out the Week on a
2311,AAA: Mideast violence could mean higher gas prices
2312,Production On Apple's iPhone 6 Rumored To Begin In July
2313,A Balm In Gilead
2314,Report: Toyota to Reach $1 Billion Settlement with Justice Dept.
2315,Kourtney Kardashian shares intimate picture of her growing baby bump
2316,John Hood: FCC should let markets work
2317,Justin Bieber nearly crashes into pedestrian
2318,ACA 'Play or Pay' Decision Guide for Employers (Infographic)
2319,General Motors Recalls Another 1.5M Vehicles for Issues Unrelated to Ignition
2320,The latest on Credit Suisse Is the Pfizer deal about drugs or taxes Happy
2321,"Mars Bar Inc. Studying the Life Saving Benefits of ""Chocolate Pills"""
2322,Did Louis Tomlinson Drop the N-Bomb in Drug Video With Zayn Malik?
2323,Straightening our crooked road
2324,Evansville metro area remains near bottom of well-being survey
2325,"Fargo, Channel 4"
2326,Headbanging blood clot risk
2327,When can I see the lunar eclipse in East Texas?
2328,The Girlfriend Experience Anthology Series Is Coming to Starz
2329,What Is Twitch Video Game Streaming? And Why Google?
2330,Publicis CEO says board backs him after Omnicom deal fails
2331,Camelopardalid meteor shower was a stunning live show
2332,German Market Notably Lower
2333,"Emma Stone steals Venice Fest spotlight with bob, dress"
2334,Meghan McCain might join 'The View'
2335,Comerica Plans Up To $236 Mln Of Stock Buybacks
2336,Google's self-driving car is getting educated on city street driving
2337,"RIP Maya Angelou, 'I Know Why The Caged Bird …"
2338,What 'House of Cards' Says About Corporate Taxes
2339,US home resales improve more than expected in May
2340,Samsung fails to stop S5 phone's early release
2341,"Britain's queen celebrates birthday, makes actress Jolie a 'dame'"
2342,NHTSA probing whether to call Nissan to the carpet over Versa unintended
2343,Barclays to cut 14000 jobs as investment bank shrinks
2344,Chronology of Pilot Flying J truck stop probe
2345,"VIDEO: SNTV - Kanye Called the Shots on ""That Cover"""
2346,Bristol-Myers Says Study of Melanoma Treatment Shows Favorable Comparison
2347,William McGurn
2348,Watch Sam Woolf Sing “You're Still the One” in American Idol 2014 Top 6
2349,Want to hear Vin Diesel speak Russian? Portugese? Check out his “voices” for
2350,'Goonies' Sequel is Happening! -- Director Richard Donner's Bringing Everyone
2351,"Katy Perry Launches Metamorphosis, Her New Joint Venture With Capitol Records"
2352,"Google Glass Adds Limited SMS Support For iPhone, Gets Calendar App"
2353,Captain America spotlights D.C.
2354,"Jolie, McCartney Partner On Maleficent Clothing Line For Kids"
2355,MARK KENNEDY - AP Drama Writer (AP)
2356,Bar Cars Make Last Run on Metro-North
2357,UCLA flood from water line rupture is red flag for LA infrastructure
2358,"Virginia Department of Health Kicks of Summer Food Program for Kids, Free"
2359,Planet 17 Times Heavier Than Earth Found by Kepler Probe
2360,High-Frequency Senate Hearings: Don't expect any policy action yet
2361,"Presidential Daily Brief for April 29, 2014"
2362,MMG identifies risks to Las Bambas schedule
2363,"Wal-Mart (NYSE: WMT) Profits Fall, Blamed on the Brutal Winter"
2364,Is Lindsay Lohan Pulling A Britney? Mean Girls Star Attacks A Car
2365,The Voice: Blind Auditions End and the Real Battles Begin! Who Rises Triumph
2366,Mila Kunis reunites with Ashton Kutcher onscreen for 'Two and a Half Men' guest
2367,Facebook rolls out 'Nearby Friends' GPS feature
2368,Mila Kunis expecting first child with fiance Kutcher?
2369,Reports: Ford CEO Mulally to Retire Earlier
2370,DirecTV Now Making It Harder For Non-Satellite Customers To Get NFL Sunday
2371,Live: Billboard Awards in Las Vegas
2372,"A Mrs. Doubtfire Family Reunion Is So On! Mara Wilson May Be Out, But Another"
2373,"Mrs. Doubtfire Sequel In The Works, Funny Man Robin Williams Back"
2374,"Benzino, 'Love & Hip Hop: Atlanta' star, shot by nephew"
2375,"Novovirus mainly spread by food workers, CDC says"
2376,Paul Walker's mother seeks legal protection for his daughter
2377,Legal Concerns Arise Due to Lack of Evidence Regarding Missing Malaysia
2378,2pac's final words: 'F**k you' to police officer
2379,Supporters push to restore millions for mental health funding
2380,"Darwin's Finches, Threatened by Blood-Sucking Maggots, Get a Helping Hand"
2381,“The Big Bang Theory” Season 8 spoilers: Jim Parsons has no contract yet for
2382,Business update: Visionary or looney? Facebook's Mark Zuckerberg on
2383,Cloudless sky offers perfect view of Ireland from space (PHOTOS)
2384,LOOK: Gallery and review of Day Two of the Wireless Festival in Birmingham
2385,Drew Barrymore and Will Kopelman Welcome Second Daughter
2386,Marvel delivers the summer movie you've been waiting for
2387,Rock Star Christine McVie Returns to Fleetwood Mac at 70
2388,Kevin Sharp fans react to his death
2389,"Crows Are As Smart As A Seven-Year-Old Child, Researchers Find"
2390,Tax day discounts you won't want to miss
2391,Lea Michele's New Boyfriend Matthew Paetz Is A Former Male Escort
2392,Bionic Pancreas Provide A New Ray Of Hope For Type One Diabetes Patients
2393,"US Stock Market Rigged, Says Moneyball Author"
2394,VIRAL VIDEO: Elementary school choir will surely make you 'Happy - WNEM TV 5
2395,Sir Mick Jagger pays tribute to L'Wren Scott during funeral
2396,General Electric posts lower profit on charges from NBC Universal sale
2397,"Here's What The iPhone 6 Might Look Like, According To Various Leaks And"
2398,Live in the Moment; Study Finds Mindfulness Meditation Reduces Stress
2399,Controversy Rocks St. Patrick's Day; Stooges Rocker Dead at 64
2400,Etihad unveils Airbus A380/Boeing 787 luxury 'Residence' innovations
2401,Three Things Tesla Must Deliver For The Model 3 To Succeed
2402,"MacBook Air Gets A Price Drop, Better Battery, New CPU"
2403,Microsoft hastens to fix IE browsers after latest attacks
2404,Ford Mustang Returns to New York to Celebrate 50 Years; 1967 Shelby GT500
2405,Linda Perry & Sara Gilbert Are Married!
2406,BMW to sink $1bn into US production expansion »
2407,Chrysler leads impressive sales gains for Detroit automakers in July
2408,BMW to add 800 jobs at S.C. plant
2409,Planned P3 Shipping Alliance Abandoned -- 5th Update
2410,"Super Smash Bros. Battles in a ""Paper Mario"" Stage on Nintendo 3DS"
2411,GM recalls Camaros for switch issue
2412,"IMF, Downgrading U.S. Growth Outlook, Cautions Investors About Interest Rates"
2413,This Aviaton Near Miss Will Give You The Chills.
2414,Montana State Health Records Compromised In Massive Data Breach
2415,American Apparel fires founder Dov Charney
2416,Security forces on high alert in China's Xinjiang after a series of deadly attacks
2417,The Dow Jumps as Alcoa's Earnings Delight Wall Street
2418,High fees eroding many 401(k)'s
2419,Lady Gaga Gives Proper Goodbye to Roseland Ballroom with Rose Inspired See
2420,Is Your 4th of July at Risk?
2421,"Kroger Eyes Online, Organic Growth With Vitacost Buy"
2422,Google Glass to the NBA. Watch the Flops in First Person
2423,Is This What The New Apple iPhone 6 Will Look Like? (video)
2424,US now loves SUVs & CUVs more than sedans
2425,"Juan Pablo: ""I Like You A Lot"""
2426,Local judge files corruption charges against Argentina Vice-President
2427,Is the Dollar at a Turning Point?
2428,Speaking a second language could prevent later-life cognitive decline
2429,Beyonce And Jay Z Divorce Rumors 2014: 'Resentment' Singer Addresses
2430,Google Fiber Holds Big Potential for GOOG Stock
2431,'The Walking Dead' preview: Is Terminus Really A Sanctuary?
2432,Another little Lachey on the way
2433,"Michael Jackson: Five years after his death, how his influence lives on"
2434,British Airways mix-up lands Granada-bound man in Grenada: lawsuit
2435,"?Test Android L Apps, Wallpapers, and More on Non-Nexus Devices"
2436,Review – Nokia Lumia 630
2437,Lily Allen gets on the Bangerz hot dog and the day's pop culture news - LIVE!
2438,Bruce Springsteen to close out NCAA music festival
2439,NHTSA opens 2 Chrysler investigations for ignition key complaints
2440,"Taco Bell's ads star real-life Ronald McDonald in Bossier City, other cities"
2441,The NSA had an easier time breaking web encryption than previously thought
2442,Weight loss surgery treats type 2 diabetes in obese patients
2443,New Public Service Campaign Uses Humor To Urge Men Over 50 To Check
2444,Bjork - Bjork's Biophilia To Be Adopted Into European Schools' Curriculum
2445,Michael Jackson's hologram to perform at Billboard Music Awards
2446,The vinyl countdown
2447,LGBT Pride Month Begins!
2448,Consumer Reports Helps You Shop for a Safer Hospital
2449,"Anne, Kristen and Brie do drag"
2450,Stocks Hitting 52-Week Highs
2451,Hillary Clinton Books Fox News Interview
2452,Katherine Webb And AJ McCarron Are Engaged And That Ring Is HUGE
2453,Siemens to decide on Alstom offer after meeting with Hollande
2454,Alcatel-Lucent completes 100G upgrade of Apollo undersea cable
2455,NASA probe slams into moon surface
2456,Justin Bieber Is Working On a Song with Chris Brown!
2457,Scotland aims to be smoke-free by 2034 but what about e-cigs?
2458,Sherri Shepherd and Lamar Sally Split; Did He Cheat on Her?
2459,FTC: Snapchat Deceived Message Senders
2460,Hookahs not a safe alternative to cigarettes
2461,Monkeys on Horses With Assault Rifles: The Trailer for Dawn of the Planet of the
2462,Did Nicki Minaj diss Iggy Azalea at BET Awards?
2463,"Beyonce, Jay Z announce first collaborative tour"
2464,US air controllers still challenged for sleep
2465,Kendall Jenner bounces around hotel room to celebrate reaching 10million
2466,Rapper Incited Riot at South By Southwest: Police
