catalog_id,text
6154,"Russia's Lukoil opens giant Iraq oil field, adding to crude glut"
6155,Mad Men Season 7 Trailer Takes Flight — But No Need to Analyze It! (VIDEO)
6156,Nintendo lost $97M last quarter even with the success of Mario Kart 8
6157,"UBS, Royal Bank of Scotland, and Julius Baer investigated for rigging exchange"
6158,True Detective season finale: A tidy conclusion that keeps us – and its stars – in
6159,Markets await Draghi after ECB maintains policy
6160,San Francisco
6161,Twitter Now Offers Mobile App Install Ads – the Same Product that Rocketed
6162,Disaster architect scoops top prize
6163,Red Cross suspends Guinea Ebola treatment after staff attacked
6164,Clooney engaged to barrister
6165,ECB bank tests may be 'too strict': Austria's Nowotny
6166,FireEye buying nPulse for $70M to gain security analytics 'flight recorder'
6167,Alibaba chair's dealings raise red flags
6168,Do You Believe Everything You Say?
6169,One College Is Offering a Very Serious Class on Miley Cyrus
6170,Making marijuana legal requires facing basic issues
6171,Dotcom's Mega seeks $210 mln backdoor listing on NZX
6172,'Captain' is still America's hero
6173,Sia lands atop 'Billboard' chart; 'Frozen' rises again
6174,Justin Bieber's Miami DUI Charges Dismissed
6175,Blood Moon Rising: How to Watch Tonight's Total Lunar Eclipse
6176,Foreclosures Linked To Higher Suicide Rates: Study
6177,Brad Pitt releases statement on red carpet accoster
6178,Why Investors Should Look Beyond Cap-Weighted ETFs
6179,Sen. Claire McCaskill Encourages Dr. Oz to Police on 'Deceptive' Weight Lost
6180,Adjuvant Chemotherapy for Breast Cancer Linked to Job Loss
6181,"Ruble, stocks extend losses after Russia says will challenge Yukos ruling"
6182,Christina Aguilera Confirms Pregnancy Like a Total Rockstar (VIDEO)
6183,Jupiter's Great Red Spot Shrinking Rapidly
6184,Fed Chair says no need to change monetary policy to tackle financial stability risks
6185,Mosaic Becomes Oversold (MOS)
6186,Microsoft Fighting US Government Over Consumer Email Privacy
6187,"On last night's season finale of The Bachelorette, Andi Dorfman broke Nick"
6188,Adam Levine Is a Heartbreaking Rock Star in 'Begin Again' Trailer [VIDEO]
6189,Fast & Furious 7: brothers of Paul Walker to help complete
6190,"Lost Andy Warhol Computer Art Found 30 Years Later, Languishing On Floppy"
6191,Seventeen Year Old BG (Boy Genius) Eric Chen Wins Another $100000 In Intel
6192,Apparently This Matters: The New Ronald McDonald
6193,What You Didn't See Behind the Scenes at Part 1 of the Dancing With the Stars
6194,Veteran access to rural health care at heart of congressional concern in ongoing
6195,"Gas prices rise in NH, Maine"
6196,Why Is Nick Cannon Dressed in White Face...and Is It Funny or Offensive?
6197,Nuclear Power Producer Exelon To Buy Pepco For $6.83 Billion
6198,Dollar Slumps After Housing Data Disappoints and Other Top Forex News.
6199,Why GE Q2 Earnings Could Be Very Difficult to Interpret
6200,China-based web company Baidu wins right to censor search results
6201,2014 Nickelodeon Kids' Choice Awards Live Stream (WATCH)
6202,One Third of Woman Face Higher Risk of Breast Cancer
6203,West Seattle weekend scene: 'Supermoon' on the rise
6204,TherapeuticsMD Now Covered by Analysts at JMP Securities (TXMD)
6205,Apple chases more money from Samsung and sales ban in patent suit retrial
6206,Create a QR Code Badge for Your BBM Channel
6207,"Bob Dylan's ""Like a Rolling Stone"" Draft Sells for Record $2M"
6208,"Pitt and Jolie Onscreen Together Again in New Movie: Brad, Angelina Met on Mr"
6209,'American Idol' Recap: Caleb Johnson & The Rest Of The Final Four Take On
6210,Tori Spelling sobs over husband's cheating in new Lifetime TV series
6211,Noah review: Aronofsky's Biblical epic is long and flawed
6212,World's largest species of lizards Komodo Dragon
6213,Are Kris and Bruce Jenner getting back together?
6214,"MTA makes pact with bus, subway workers"
6215,US 10-Year Auction Leaves Dealers With Most Since July
6216,Sprint to pay $7.5 mln in record US settlement for unwanted calls
6217,Opposing View: Was Mozilla Flap Counter-Productive to Gay Rights?
6218,How Your Heart Health In Young Adulthood Affects Your Middle-Aged Brain
6219,John Stamos spearheading Full House reboot
6220,Tyler Posey and Zendaya to Co-Host MTV Music Awards Pre-Show
6221,Pay raises go mainly to those in select industries
6222,Kids of All Ages Celebrate National Grilled Cheese Day
6223,Global warming dials up risks
6224,WHAT'S HAPPENING IN HIP-POP: Sofia Vergara Is Back On The Market
6225,"Coldplay conjures 'Magic' in retro, romantic B&W video"
6226,Ahead of the Bell: US trade gap
6227,Is Work Relaxing Or Stressful?
6228,They're letting Madonna direct another movie
6229,A Million Ways to Die in the West review: Seth MacFarlane misfires
6230,Interpublic Group of Companies Inc.: Interpublic Announces Second Quarter and
6231,'SNL' Season 40: Cast Members Noël Wells and John Milhiser Also Fired
6232,Approval for powdered alcohol developed in AZ 'issued in error' - KCTV5
6233,SRT Jeep Grand Cherokee Hellcat Could Obliterate Every SUV on Earth…Period
6234,Amazon takes e-book offer directly to authors
6235,Justin Bieber's DUI charges are dropped after he agrees to plea bargain
6236,Vodafone eyes Wi-Fi calling for iPhones on iOS 8
6237,Tax Day Deadline Details — And Freebies
6238,Therapy Dogs Helping Soldiers with PTSD
6239,Mayo Clinic ranked No. 1 hospital in US News & World Report
6240,A look at convicted politicians who try comebacks
6241,Inter-Ministerial Team On Ebola Viral Disease Formed
6242,Google gives a pre-quake view of Christchurch
6243,Federal Judge Will Not Block Arizona Rules Limiting Use Of Abortion Drugs
6244,Longevity Gene Variant Could Also Boost Learning And Memory
6245,MH370 Tragedy: UN leads effort to improve plane tracking
6246,Consumer Sentiment Up in April in U.S.
6247,'Grey's Anatomy:' Cristina Yang says goodbye
6248,"Cheated Shoe Workers Strike, Shut Down Chinese Factories"
6249,European stocks decline in risk-off trade; Dax down 0.77%
6250,Josh Elliott leaves 'GMA' for NBC. Network doesn't allow him to say goodbye
6251,Oculus Backers On Kickstarter Won't Get Any Part Of The $2 Billion Deal
6252,Uber raising a new round at a $10B valuation?
6253,"Ebola outbreak 'out of control,' ravaging West Africa, doctors warn"
6254,Mysterious glow on Mars is not life: NASA
6255,Lenovo recalls ThinkPad battery packs on fire risk
6256,Who is the man found behind Picasso's masterpiece 'The Blue Room'?
6257,Kids Series 'The Magic School Bus' Gets New Coat Of Paint For Netflix
6258,ISS astronauts to get hot coffee
6259,HTC Posts Official Intro Video and Images of the HTC One M8
6260,Windows Phone 8.1 gets an update; Cortana goes to China and UK
6261,UK inflation rate falls to 1.5% in May
6262,Bank Earnings Reports: JPMorgan Chase Versus Wells Fargo
6263,"T&Mobile Launches ""Unradio"" Music Streaming Service with Rhapsody"
6264,American Apparel Lender Said To Want CEO Back Or Will Call Loan
6265,Andrew Garfield cross-dresses in new Arcade Fire video 'We Exist'
6266,Sitting for a Longer Time Ups the Risk of Developing Several Types of Cancer
6267,Jonah Hill Throws Homophobic Slur at Paparazzo
6268,"'Arrow' on 'DC All Access': Season 2, episodes 19 and 20 sneak peeks, behind"
6269,"Iraq files for arbitration against Turkey, Botas"
6270,Stocks drift higher; S&P 500 holds at 2000 points
6271,"Buns, eggs & bunnies"
6272,"Lavrov: Among all vicissitudes of the history of the Russia-Bulgaria relations, we"
6273,Tesla Talks Up Batteries
6274,ECB's Draghi: Various easing measures could be adopted to counter prolonged
6275,Aereo vs. broadcasters: Start of Supreme Court review is inconclusive
6276,Photo Release -- Jacksonville Jaguars Partner With Daktronics to Install World's
6277,Is the Federal Reserve Killing Growth?
6278,"3D mammograms may improve breast cancer screening, at a cost"
6279,Jamie Dimon: $100M investment in Detroit isn't a JPMorgan Chase PR campaign
6280,Sandra Bullock vs. stalker: Guess who wins?
6281,Met Opera asks mediator to resolve labor gridlock
6282,Halting the spread of Ebola: Stop handshake -WHO recommends
6283,Are Eva Mendes and Ryan Gosling expecting a baby?
6284,Amazon Gets Exclusive Streaming Rights to Action Series '24' Including '24: Live
6285,"LinkedIn Hits New Milestone,Sees 50% Traffic from Mobile"
6286,In the papers: Alibaba chooses NYSE over NASDAQ
6287,Did Kate Middleton Pose Butt-Naked in Australia? German Publication Bild
6288,"Ryan Gosling, Beyonce and Chris Martin land in our MORNING QUICKIES"
6289,Reading at Chipotle: Cultivating Thought at a fast food restaurant
6290,Wal-Mart taps Leawood-based Euronet to launch money transfer in stores
6291,Microsoft to make largest staff cuts since 2009
6292,Christine Baranski's Husband Of 30 Years Matthew Cowles Passes Away
6293,UK cities bid for driverless car trials
6294,Hangin' tough with NKOTB reality show
6295,"IBM earnings: $2.54 per share, ex-items, on $22.48 billion in revenue"
6296,"UPDATE 2-UK inflation jumps in June, rate hike bets brought forward"
6297,O'Brien promises the unexpected at MTV Movie Awards
6298,GM safety crisis grows with recall of 3 million more cars (VIDEO)
6299,Hubble Celebrates It's 24th Birthday With A Monkey
6300,US gains trade victory in auto dispute with China
6301,Legislation calls for closure of Duke's coal ash ponds
6302,Washington state park closes over health scare
6303,Amazon Dash is the company's latest gadget to get you using their grocery
6304,"Google, Other Tech Companies Among Top Employers"
6305,Google I/O 2014: Samsung expands Gear portfolio with Android Wear
6306,Townsend to offer 24-hour drug drop-off at police station
6307,Sequel flies as high as original
6308,Gas prices are all over the map
6309,Nicki Minaj describes near-death experience in BET Awards speech
6310,Mormon show takes plaudits at theatre awards
6311,Some Chinese vent over Alibaba's big foreign stakeholders
6312,Bryan Singer's lawyer says abuse claims fabricated
6313,When is the Surface Pro 3 launch?
6314,Fashion to be largest category for next few years: Flipkart
6315,Abu Dhabi's Etihad Airways plans to offer bed and bath suites
6316,Chaos in Iraq sends gas prices soaring; Here's where Oklahoma stands
6317,US to cede control of internet address system
6318,​T-Mobile quadruples data in response to new Sprint pricing
6319,"Japan ""strongly concerned"" about China-Vietnam maritime confrontation"
6320,Idina Menzel Starrer 'If/Then' Navigates the Road to Broadway
6321,Here's a preview of some potential designs for Google's Project Ara
6322,"Lana Del Rey Debuts ""Ultraviolence"" Live"
6323,Projections for winter wheat fall
6324,"Kim Kardashian and Kanye West Tie the Knot in Florence, Italy!"
6325,Study: Over-fortified cereals may harm kids' health
6326,Beyoncé and Jay Z reveal secret wedding video and birth of Blue at On The Run
6327,Kendall Jenner goes KNICKERLESS in daring double thigh split dress on
6328,"With MERS concerns rising, WHO warns about some camel products, contact"
6329,Stocks Are Falling
6330,"How to attract a woman on the dance floor, courtesy of science"
6331,Commodities: Iraq fears fuel buyer interest
6332,Urban Outfitters Price Target Cut to $38.00 by Analysts at UBS AG (URBN)
6333,S&P raises outlook on UK to 'stable'
6334,Caterpillar CEO Oberhelman's Pay Declines 33% In 2013
6335,US stocks: Nasdaq marks worst day since November 2011 as biotechs sink
6336,Colbert Tries to Distance Himself From Tweet That Was Based on His Own Words
6337,Facebook Q2 May Be Buoyed By Lightning Fast Ad Market (FB)
6338,4 Speed-Reading Apps To Give You Lightning Fast Eyes
6339,US settlement talks break down with Citigroup
6340,"White House: Yes, we're lying about the 'wage gap,' and we're not going to stop"
6341,"Therapy dog helps US troops deal with post war stress, keeps them coming back"
6342,'Game of Thrones' Season 4 Release Date & Spoilers: Secret Book Chapter 'The
6343,Tupac's Last Words: Former Las Vegas Cop Recalls Final Words Uttered by
6344,"BBC Renews 'Orphan Black,' 'Broadchurch' and Orders New Series"
6345,"On “Deep Decarbonization,” Governments Not Involved, Ban Takes No Qs"
6346,US stocks fall as tech-led selloff extends; Dow down 1.02%
6347,Tesla electric cars only a shock to old fogeys
6348,Fruitland American Meat 4000 pounds beef recall - mad cow on the moooove?
6349,"Recognize the brutal, true message of Easter"
6350,Tape Of Anti-Gay Remarks Made On Salem's Janet Mefferd Show Costs
6351,"Mayor de Blasio ""extremely disappointed"" in large soda ban ruling"
6352,Things we learned from 'GAME OF THRONES' & 'SOPRANOS' Despite vast
6353,Why King Digital Entertainment (KING) Stock Is Up Today?
6354,Study: Electrical implant helps paralyzed men move their legs
6355,"Climate change a threat to 'human health and well-being,' US report warns"
6356,Gold Galaxy S5 heads to USA and UK
6357,'Midnight Rider' pair surrender to police
6358,'Heathers' musical opens in New York following LA run
6359,Beverly Hills Hotel Targeted by Boycott
6360,Whole Foods plans Richmond store near Fan
6361,Rapper Benzino Shot In Mother's Funeral Procession
6362,"Zac Efron Probably Buying DRUGS On Skid Row, Friends Say; 'Bodyguard' Was"
6363,NTT DOCOMO to Offer iPad Air and iPad mini in Japan
6364,Cheapest gas today is in northern York County for $3.45 a gallon
6365,Google explains Android L's gorgeous new design in language no one will
6366,U.S. Markit Flash April PMI Stands at 55.4 as Output Rises
6367,Merger to create world's biggest cement maker
6368,Asian shares pare losses
6369,'Game of Thrones' Scorecard: Survival of the ruthless
6370,Now in India At Rs. 330 per month Microsoft Office 365 Available
6371,Facebook Totally Screwed with a Bunch of People in the Name of Science
6372,Polio perishes in India
6373,Garth Brooks: All Concerts Canceled in Ireland
6374,Cigarettes in Switzerland Published
6375,Grey's Anatomy Season 10 Finale Spoilers: 6 Things We Learn From the Sneak
6376,Google acts to stop NSA spying on Gmail data
6377,Apple iPad Mini 2 vs Samsung Galaxy Tab 3 10.1: Which device is the best ?
6378,Samsung Electronics' 2Q profit miss forecast
6379,S&P 500 index holds at record level
6380,Top films at the North American box office
6381,National Briefs: Data broker measure urged
6382,Kids: take your mark
6383,IMF chief is target of French corruption investigation
6384,The Batman-Superman Movie Has Found Its Cyborg
6385,Public hearing set on medical marijuana rules
6386,"Meet Mark Schindele, Target's new top man in Canada"
6387,Wall Street expects Apple's WWDC announcements will leverage strength of
6388,Spend the Next Hour of Your Life Watching a Livestream of the Whale at the
6389,"Fourth of July can be glorious, but it must also be safe"
6390,"Seth Rogen, Judd Apatow Reluctantly Dragged Into #YesAllWomen Twitter"
6391,Tupac Shakur Musical 'Holler if Ya Hear Me' to Close on Sunday
6392,Target removes CEO in wake of devastating cyber data attack at clothing firm
6393,Thursday Morning Rundown
6394,"Facebook to Pull Messaging Feature from Main App, Wants You to Use"
6395,'Godfather' Cinematographer Gordon Willis Dies at 82
6396,Marketing the moon
6397,Siemens offer for Alstom likely on Tuesday
6398,Virgin America files plans for IPO
6399,"Rate of Antarctic ice loss doubled in recent years, study finds"
6400,Chloe Moretz Inspires Denzel Washington to Kick Ass Again in 'The Equalizer
6401,Backstage Details On How Daniel Bryan Is Being Viewed & Whether He Is Still
6402,Burberry share price: Second-half revenue surges 19 percent
6403,Lenovo Will Reportedly Flood The Market With 60 Smartphones This Year
6404,Mr And Mrs Smith 2? Brad Pitt And Angelina Jolie Planning To Star Together In
6405,Could watching too much TV kill you? (Study)
6406,Our planet's most abundant mineral now has a name
6407,Intuitive Surgical injects new life into market
6408,Sanctions vs Russia may seriously affect European economy - European
6409,Windows 8.2 likely in autumn
6410,Twitter Price Target Cut to $55.00 (TWTR)
6411,Are You Ready For the Netflix Channel?
6412,"'SpaceShipTwo, Serial Two': Inside Virgin Galactic's newest passenger spaceship"
6413,US Lawmaker: Ban Travel to US from Ebola-stricken Countries
6414,Malia Obama's Summer Job Is Cooler Than Yours
6415,"US stocks rebound from midday slump, extending modest gains for second day"
6416,Facebook's Emotion Study Was All About Keeping Us Addicted To Facebook
6417,Titanosaur: biggest dinosaur ever? Museo Paleontologico Egidio Feruglio
6418,Focus: Hillshire diversifies with Pinnacle deal
6419,WhatsApp CEO sets the record straight on Facebook partnership as it relates to
6420,Fruits and veggies aplenty will optimize health
6421,European stocks mixed as takeovers in focus
6422,Report: Kim Kardashian and Kanye West's Wedding Invitation Revealed
6423,Flappy Bird Creator Says Flappy Bird Will Return
6424,Ovarian Cancer Directly Linked for First Time to Being Overweight
6425,Businesses fear ripple effects from 'cosmetic' Russian sanctions
6426,"iOS 7.1 adds manual control of Siri, Apple CarPlay"
6427,Weird Al's 'Mandatory Fun' shows the joker is back on top
6428,Yahoo Just Started Its Own Video Streaming Site! Yahoo Screen Competing
6429,Next on the Starbucks menu: a jolt for your phone
6430,Disney to release 'Captain America 3' film in May 2016
6431,Mad Men: The Runaways: Episode 5 Season 7—TV Review
6432,Google Guy Comes Home To Find Fliers Labeling Him A 'Parasite' Plastered
6433,"GLOBAL MARKETS-Asian shares hit 6-1/2 year high, dollar steady before Fed"
6434,Two new Spielberg movies get release dates!
6435,Germany's RWE starts reverse-flow natural gas deliveries to Ukraine | The
6436,Woody Allen criticized for featuring nearly all-white cast in new play
6437,Spider causes Mazda6 sedan recalls for second time in three years
6438,Maks Admits 'Incredible Connection Right Away' With Meryl — Watch
6439,"Samsung Makes Price For Gear 2 and Gear Fit Official Price, Is It too Late?"
6440,'Fury' trailer
6441,Climate scientists in Japan to study warming risks
6442,PS4 Vs. Xbox One: Sony Outsells Microsoft For Six Months Straight
6443,Destiny Beta to begin in July on PlayStation platforms first.
6444,"Beyonce Named Forbes' Most Powerful Celebrity Ahead Of Jay Z, Dr. Dre, And"
6445,"Prince Wows World With Announcement Of Not One, But Two New Albums"
6446,Good Luck Collecting the $50 Billion
6447,Powdered alcohol--'Palcohol'--headed to US liquor stores
6448,NJ Transit says LIRR strike would not disrupt service at New York Penn Station
6449,"Expensive Food Tastes Better, So 'Eat At The Most Expensive Buffet You Can"
6450,Hobbit: Battle of the Five Armies Trailer Released: Martin Freeman
6451,US hopeful of WTO deal with India hours before deadline
6452,Wikipedia Is Better Than Google at Tracking Flu Trends // 5:08 PM ET
6453,Michael Lewis Talks About Flash Boys
6454,Pharma deal sparks TSX
6455,Reports hinting at an alleged sub-$100 Google Nexus smartphone
6456,"An Unscientific Defence of Swine Flu Drug Tamiflu, by Someone Who Took It"
6457,Deadly Ebola outbreak spreads from Guinea to neighbouring countries
6458,Ginnifer Goodwin & Josh Dallas Tie The Knot! Get The Deets On Their Fairytale
6459,Suspected Ebola case investigated in Ghana
6460,Facebook share price: Company updates messenger to challenge Snapchat
6461,"FOREX-Yen reclaims lost ground against dollar, euro"
6462,Is Windows Enterprise right for your SMB?
6463,VIDEO: Netflix Releases the Trailer for Season 2 of ORANGE IS THE NEW BLACK
6464,SEE IT: NASA creates image of Earth using more than 36000 selfies from around
6465,Critics KO Ryan Gosling's 'Lost River' in Cannes
6466,DOJ finds pattern of excessive police force in Albuquerque
6467,"Amazon launches Prime Music, a free song streaming service for Prime"
6468,"Catch me if you can: Spotify touts 10M paying subscribers, well out in front of"
6469,Wall Street's Thoughts On Zuckerberg's Latest Purchase
6470,Chipotle raising prices for the first time in 3 years
6471,Food industry groups sue to block Vermont's GMOs labeling law
6472,Los Angeles mayor: Stanley Cup victory 'big f---ing day' for the city
6473,"Game Of Thrones Season 4, Episode 3 Preview: Watch The Fallout From Last"
6474,Paul Walker Crash: Speed up to 94 mph singled out in deadly crash
6475,Mayor Touts School Programs to Serve the 'Whole Child'
6476,APNewsBreak: Speed to blame for Walker crash
6477,7Summits Delivers New Solutions with Salesforce Communities
6478,Google changes ad policies for Apps for Education to protect students' personal
6479,Has Chris Colfer been fired from 'Glee'?
6480,'Heaven Is for Real' — and for everyone in new film
6481,Ecigarette battle heats up as scientists demand strict regulation from the WHO
6482,INSIGHT-Mega-IPO to rekindle the 'bromance' behind Alibaba's rise
6483,Jared Leto Rumored To Be Up For Doctor Strange Role
6484,"Decision on Love Field gates has not been made, executives say"
6485,Akron weekly gas update for May 5
6486,A guide through the complexities of 401(k) fees
6487,Bachelorette 2014: 5 Biggest WTF Moments From Fantasy Suites
6488,Localized Prostate Cancer: Little to Gain From Early ADT
6489,NASA Unveiling Instruments for 2020 Mars Rover Thursday: How to Watch Live
6490,Teen wins $100000 for flu advance
6491,Celebrity birthdays for the week of Aug. 31-Sept. 6
6492,Who Wore It Better: Khloe Kardashian VS Kris Jenner
6493,"Microsoft goes all in for Bonnaroo music festival, will stream live to Xbox"
6494,New image showing Loch Ness Monster 'is a boat'
6495,IRS awards bonuses to 1100 who owe back taxes - FOX Carolina 21
6496,Loch Ness 'Nessie' sighting excites then disappoints fans of the Scotland myth
6497,Recall Costs Only Dampen GM's First Quarter
6498,Netflix gets specific about its battle with Comcast and opposition to the TWC
6499,"US Patent Office Rules Redskins Name Is Offensive, Cancels Trademarks"
6500,The Purple Wedding's Big Question: Who Did It?
6501,SunPower Shines With Google in Residential Solar
6502,"Kanye West returning to city where he proposed to Kim Kardashian, San Francisco"
6503,Rihanna supports Jay-Z after Solange's elevator attack witnessed by Beyonce
6504,Garth Brooks fans camped for dream tickets... now they're out in cold again
6505,"Cervical Cancer Rates Underestimated, Study Says"
6506,Solange Illuminati Hoax: Solange Knowles 'Admitted to Psychiatric Hospital After
6507,"NASA Ames Launches Nanosatellites, Science Experiments on SpaceX Rocket"
6508,Ford recalls Escape and C-Max vehicles; Chrysler recalls some minivans
6509,'Godzilla' tramples rivals with monster $93M debut
6510,'The Voice' battle rounds kick off tonight: Shakira has a master plan
6511,"Rihanna Deletes #FreePalestine Tweet, Claims It Was An Error"
6512,Along The Route: Hopkinton Heralds The Boston Marathon
6513,"'Divergent' author: ""It's been surreal"" (w/video)"
6514,Sony PSP Handheld Games Console Discontinued In Japan
6515,Amazon fights FTC over request to tighten mobile in-app purchases
6516,Gold Falls After Strong US NFP Figures
6517,Former Microsoft employee arrested and charged with leaking company
6518,Uber Gets Down To Business With New Travel Expense Tools And Concur
6519,Poll: 47% of Unemployed Given Up Looking for Job
6520,US auto parts supplier to outsource interiors to China
6521,US stocks drop on mixed retail earnings
6522,Worst quarterly results in two years for Samsung Electronics
6523,American Apparel appoints financial advisor
6524,North Carolina homeowners to get $21 million in SunTrust mortgage settlement
6525,Is Gwyneth Paltrow Using Her Divorce As A Very Effective GOOP Marketing Tool?
6526,"Mobile woman among 12 chasing fake prince in ""I Wanna Marry 'Harry'"""
6527,Army's hypersonic missile fails during test
6528,PRECIOUS-Gold down ahead of Fed's minutes; palladium near 3-year high
6529,Malaysia releases missing jet satellite data after demands of transparency
6530,"Nas' 'Time Is Illmatic': An Inside Look At the Tribeca Film Fest Premiere, Concert"
6531,Coach Sliding After North American Comparable Sales Plunge 21%
6532,Intel Beats Q1 Earnings Estimates; Revenue Misses (INTC)
6533,Dimon vows to continue leading JP Morgan Chase while fighting cancer
6534,Critics Slam Ryan Gosling's 'Lost River' in Cannes
6535,Amazon (AMZN) Fire Smartphone Unlikely to Hurt Apple (AAPL) iPhone
6536,Ryan Gosling's 'Lost River' Gets Its First Teaser Clip
6537,PetSmart Surges After Being Targeted by Activist Fund
6538,State Water Project allocations increase to 5 percent
6539,Baby boomers turn to reverse mortgages
6540,'The Voice' Recap: Shakira's 'She-Wolf' Strategies On Show As Blind Auditions
6541,Facebook's Sheryl Sandberg apologizes for news feed experiment
6542,No sign Tamiflu works well to stop flu outbreaks: study
6543,"26/06/2014WHO urges 'drastic action' on Ebola, calls 11-nation meeting"
6544,Christina Ricci Is Going To Be A Mommy!
6545,Panasonic Pondering Investment in Tesla Gigafactory
6546,UPDATE 2-Eleven miners trapped underground in Honduran gold mine
6547,'Neighbors' starts with $2.56 million; can it throttle Spidey?
6548,2018 Mission: Mars Rover Prototype Unveiled in UK
6549,Libyan rebels to reopen two eastern oil ports on Sunday
6550,"Gold steady near two-month high, poised for second quarterly gain"
6551,Selena Gomez's 'Love Yourself First' Tattoo
6552,Cancer survivors invited to social on April 27
6553,Movie review: 'Transcendence' is a smart sci-fi action film
6554,Channing Tatum's new sci-fi action flick 'Jupiter Ascending' release pushed back
6555,IMF lowers estimate of US economic growth in
6556,No Bradley Cooper? No Problem: Jimmy Kimmel And The Clintons Snap Rival
6557,Windows Threshold will work differently based on your hardware
6558,Bank of America reports first quarterly loss since 2011 on lofty legal bill
6559,Court of Justice to decide the future of whaling today
6560,Watch: TomoNews takes on the Bieber-Yasukuni Shrine fiasco
